{"promotion":{"candidate_sources":[{"artifact_ref":"data/production/cadengbench_p_1800_v2_two_source_r25/materialization/source_items/p_fusion360_001312/native/27450_ee1980ca_0000.json","authority":"verified_replay","evidence_status":"promoted","source_type":"qualified_source_bound_replay"}],"rejection_reason":null,"scorer_allowed":true,"status":"promoted","validation":{"logs":["data/production/cadengbench_p_1800_v2_two_source_r25/dataset/items/p_fusion360_001312/domain/parametric_edits/v2/replay/probe_00_270p0/dfm_fact_packet.json","data/production/cadengbench_p_1800_v2_two_source_r25/dataset/items/p_fusion360_001312/domain/parametric_edits/v2/replay/probe_00_270p0/model.fusion360.json","data/production/cadengbench_p_1800_v2_two_source_r25/dataset/items/p_fusion360_001312/domain/parametric_edits/v2/replay/probe_00_270p0/execution.json","data/production/cadengbench_p_1800_v2_two_source_r25/dataset/items/p_fusion360_001312/domain/parametric_edits/v2/replay/probe_00_270p0/model.step","data/production/cadengbench_p_1800_v2_two_source_r25/dataset/items/p_fusion360_001312/domain/parametric_edits/v2/replay/probe_01_330p0/dfm_fact_packet.json","data/production/cadengbench_p_1800_v2_two_source_r25/dataset/items/p_fusion360_001312/domain/parametric_edits/v2/replay/probe_01_330p0/model.fusion360.json","data/production/cadengbench_p_1800_v2_two_source_r25/dataset/items/p_fusion360_001312/domain/parametric_edits/v2/replay/probe_01_330p0/execution.json","data/production/cadengbench_p_1800_v2_two_source_r25/dataset/items/p_fusion360_001312/domain/parametric_edits/v2/replay/probe_01_330p0/model.step"],"negative_mutants_rejected":true,"nominal_pass":true,"perturbation_pass":true,"sample_count":2,"scorer_version":"cadengbench-parametrics.v2","solver_status":"holds","validation_command":"python -m cadengbench.pipeline validate --completion-contract"}},"record_type":"relation_promotion","relation":{"authority":"verified_replay","comparison":{"left":{"key":"solid_count","node_type":"variable","source":"geometry","state":"current","unit":"1"},"operator":"equal","right":{"key":"solid_count","node_type":"variable","source":"geometry","state":"baseline","unit":"1"},"tolerance":{"kind":"absolute","unit":"1","value":1e-05}},"hard":false,"relation_id":"p_fusion360_001312:relation:preserve_solid_count","relation_kind":"preserved_feature","replay_scope":"all_valid"},"schema_version":"cadengbench-p.relation.v2"}
