{"promotion":{"candidate_sources":[{"artifact_ref":"data/production/cadengbench_p_1800_v2_two_source_r25/materialization/source_items/p_benchcad_000518/native/cadquery.py","authority":"verified_replay","evidence_status":"promoted","source_type":"qualified_source_bound_replay"}],"rejection_reason":null,"scorer_allowed":true,"status":"promoted","validation":{"logs":["data/production/cadengbench_p_1800_v2_two_source_r25/dataset/items/p_benchcad_000518/domain/parametric_edits/v2/replay/probe_00_39p123/model.cadquery.py","data/production/cadengbench_p_1800_v2_two_source_r25/dataset/items/p_benchcad_000518/domain/parametric_edits/v2/replay/probe_00_39p123/dfm_fact_packet.json","data/production/cadengbench_p_1800_v2_two_source_r25/dataset/items/p_benchcad_000518/domain/parametric_edits/v2/replay/probe_00_39p123/execution.json","data/production/cadengbench_p_1800_v2_two_source_r25/dataset/items/p_benchcad_000518/domain/parametric_edits/v2/replay/probe_00_39p123/model.step","data/production/cadengbench_p_1800_v2_two_source_r25/dataset/items/p_benchcad_000518/domain/parametric_edits/v2/replay/probe_01_47p817/model.cadquery.py","data/production/cadengbench_p_1800_v2_two_source_r25/dataset/items/p_benchcad_000518/domain/parametric_edits/v2/replay/probe_01_47p817/dfm_fact_packet.json","data/production/cadengbench_p_1800_v2_two_source_r25/dataset/items/p_benchcad_000518/domain/parametric_edits/v2/replay/probe_01_47p817/execution.json","data/production/cadengbench_p_1800_v2_two_source_r25/dataset/items/p_benchcad_000518/domain/parametric_edits/v2/replay/probe_01_47p817/model.step"],"negative_mutants_rejected":true,"nominal_pass":true,"perturbation_pass":true,"sample_count":2,"scorer_version":"cadengbench-parametrics.v2","solver_status":"holds","validation_command":"python -m cadengbench.pipeline validate --completion-contract"}},"record_type":"relation_promotion","relation":{"authority":"verified_replay","comparison":{"left":{"key":"cadquery_parameter_mm:box_arg_0","node_type":"variable","source":"geometry","state":"current","unit":"mm"},"operator":"equal","right":{"key":"box_arg_0","node_type":"variable","source":"parameter","state":"current","unit":"mm"},"tolerance":{"kind":"absolute","unit":"mm","value":1e-05}},"hard":true,"relation_id":"p_benchcad_000518:relation:candidate_parameter_geometry_binding","relation_kind":"dependency","replay_scope":"all_valid"},"schema_version":"cadengbench-p.relation.v2"}
