{"promotion":{"candidate_sources":[{"artifact_ref":"data/production/cadengbench_p_1800_v2_two_source_r25/materialization/source_items/p_benchcad_000333/native/cadquery.py","authority":"verified_replay","evidence_status":"promoted","source_type":"qualified_source_bound_replay"}],"rejection_reason":null,"scorer_allowed":true,"status":"promoted","validation":{"logs":["data/production/cadengbench_p_1800_v2_two_source_r25/dataset/items/p_benchcad_000333/domain/parametric_edits/v2/replay/probe_01_17p457/model.cadquery.py","data/production/cadengbench_p_1800_v2_two_source_r25/dataset/items/p_benchcad_000333/domain/parametric_edits/v2/replay/probe_01_17p457/dfm_fact_packet.json","data/production/cadengbench_p_1800_v2_two_source_r25/dataset/items/p_benchcad_000333/domain/parametric_edits/v2/replay/probe_01_17p457/execution.json","data/production/cadengbench_p_1800_v2_two_source_r25/dataset/items/p_benchcad_000333/domain/parametric_edits/v2/replay/probe_01_17p457/model.step"],"negative_mutants_rejected":true,"nominal_pass":true,"perturbation_pass":true,"sample_count":1,"scorer_version":"cadengbench-parametrics.v2","solver_status":"holds","validation_command":"python -m cadengbench.pipeline validate --completion-contract"}},"record_type":"relation_promotion","relation":{"authority":"verified_replay","comparison":{"left":{"key":"hole_arg_0","node_type":"variable","source":"parameter","state":"current","unit":"mm"},"operator":"equal","right":{"node_type":"literal","unit":"mm","value":17.457},"tolerance":{"kind":"absolute","unit":"mm","value":1e-05}},"hard":false,"relation_id":"p_benchcad_000333:relation:target_parameter","relation_kind":"equality","replay_scope":"target_only"},"schema_version":"cadengbench-p.relation.v2"}
