{"promotion":{"candidate_sources":[{"artifact_ref":"data/production/cadengbench_p_1800_v2_two_source_r25/materialization/source_items/p_fusion360_001165/native/21338_d5c31ee8_0000.json","authority":"verified_replay","evidence_status":"promoted","source_type":"qualified_source_bound_replay"}],"rejection_reason":null,"scorer_allowed":true,"status":"promoted","validation":{"logs":["data/production/cadengbench_p_1800_v2_two_source_r25/dataset/items/p_fusion360_001165/domain/parametric_edits/v2/replay/probe_00_1p8/dfm_fact_packet.json","data/production/cadengbench_p_1800_v2_two_source_r25/dataset/items/p_fusion360_001165/domain/parametric_edits/v2/replay/probe_00_1p8/model.fusion360.json","data/production/cadengbench_p_1800_v2_two_source_r25/dataset/items/p_fusion360_001165/domain/parametric_edits/v2/replay/probe_00_1p8/execution.json","data/production/cadengbench_p_1800_v2_two_source_r25/dataset/items/p_fusion360_001165/domain/parametric_edits/v2/replay/probe_00_1p8/model.step","data/production/cadengbench_p_1800_v2_two_source_r25/dataset/items/p_fusion360_001165/domain/parametric_edits/v2/replay/probe_01_2p2/dfm_fact_packet.json","data/production/cadengbench_p_1800_v2_two_source_r25/dataset/items/p_fusion360_001165/domain/parametric_edits/v2/replay/probe_01_2p2/model.fusion360.json","data/production/cadengbench_p_1800_v2_two_source_r25/dataset/items/p_fusion360_001165/domain/parametric_edits/v2/replay/probe_01_2p2/execution.json","data/production/cadengbench_p_1800_v2_two_source_r25/dataset/items/p_fusion360_001165/domain/parametric_edits/v2/replay/probe_01_2p2/model.step"],"negative_mutants_rejected":true,"nominal_pass":true,"perturbation_pass":true,"sample_count":2,"scorer_version":"cadengbench-parametrics.v2","solver_status":"holds","validation_command":"python -m cadengbench.pipeline validate --completion-contract"}},"record_type":"relation_promotion","relation":{"authority":"verified_replay","comparison":{"left":{"key":"fusion_extrude_distance_mm:fusion360:ee35e5b5-e2b4-11ea-a35b-54bf646e7e1f:distance","node_type":"variable","source":"geometry","state":"current","unit":"mm"},"operator":"equal","right":{"key":"extrude_distance","node_type":"variable","source":"parameter","state":"current","unit":"mm"},"tolerance":{"kind":"absolute","unit":"mm","value":1e-05}},"hard":true,"relation_id":"p_fusion360_001165:relation:candidate_parameter_geometry_binding","relation_kind":"dependency","replay_scope":"all_valid"},"schema_version":"cadengbench-p.relation.v2"}
